{
  "callId": "c-abc123",
  "accountId": "c-abc123",
  "applicationId": "c-abc123",
  "to": "sample-value",
  "from": "sample-value",
  "direction": "inbound",
  "state": "initiated",
  "startTime": "2026-04-19T14:30:00Z",
  "answerTime": "2026-04-19T14:30:00Z",
  "endTime": "2026-04-19T14:30:00Z",
  "disconnectCause": "sample-value",
  "tag": "sample-value",
  "callUrl": "https://example.com/callback"
}